{
  "$schema": "https://json-schema.org/draft/2020-12/schema",
  "$id": "https://formspec.org/schemas/response/1.0",
  "title": "Formspec Response",
  "description": "A Formspec Response document — a completed or in-progress Instance pinned to a specific Definition version (§2.1.6). A Response is the unit of data capture: the filled-in form. It references exactly one Definition by the immutable tuple (definitionUrl, definitionVersion). A conformant processor MUST reject a Response whose definitionVersion does not match any known Definition at the given definitionUrl. Responses are always validated against their pinned Definition version, even if a newer version exists (Response Pinning Rule VP-01). The tuple (definitionUrl, definitionVersion) combined with the Response 'id' uniquely identifies a single form submission across all systems. A Response MAY also carry authored signature evidence records that bind one or more signer/document acts to the canonical response envelope.",
  "type": "object",
  "required": [
    "$formspecResponse",
    "definitionUrl",
    "definitionVersion",
    "status",
    "data",
    "authored"
  ],
  "additionalProperties": false,
  "dependentRequired": {
    "authoredSignatures": ["id"]
  },
  "$defs": {
    "AuthoredSignatureIdentityBinding": {
      "type": "object",
      "description": "Provider-neutral identity-binding evidence attached to an authored signature. This records how the signer identity was bound to the signing act without baking one provider or ceremony vendor into the Response contract.",
      "required": ["method", "assuranceLevel"],
      "additionalProperties": false,
      "properties": {
        "method": {
          "type": "string",
          "pattern": "^(none|email-otp|sms-otp|knowledge-based|oidc|webauthn|credential|in-person|notary|x-[a-z0-9][a-z0-9-]*)$",
          "description": "Authentication method used to bind the signer identity to the authored signing act.",
          "examples": ["email-otp", "credential", "notary"]
        },
        "assuranceLevel": {
          "type": "string",
          "enum": ["none", "low", "standard", "high", "very-high"],
          "description": "Assurance strength reached by the identity-binding evidence.",
          "examples": ["standard", "high"]
        },
        "providerRef": {
          "type": "string",
          "format": "uri",
          "description": "URI reference to the identity or signature provider used for this identity binding, when one exists.",
          "examples": ["urn:agency.gov:identity:providers:email-otp"]
        },
        "externalAttestationRef": {
          "type": "string",
          "format": "uri",
          "description": "URI reference to an external identity attestation that supports this signature evidence, when one exists.",
          "examples": ["urn:agency.gov:identity:attestations:notary:case-2026-0042"]
        }
      }
    },
    "AuthoredSignature": {
      "type": "object",
      "description": "Canonical authored-signature evidence attached to a Response. Each record binds one signer/document act to the Response envelope. The signature value may be a drawn-image reference, a typed-signature token, a detached cryptographic signature blob, or a provider-managed ceremony reference, but a signature value alone is not sufficient signing intent.",
      "required": [
        "documentId",
        "signatureValue",
        "signatureMethod",
        "signerName",
        "signedAt",
        "consentAccepted",
        "consentTextRef",
        "consentVersion",
        "affirmationText",
        "documentHash",
        "documentHashAlgorithm",
        "responseId",
        "signatureProvider",
        "ceremonyId"
      ],
      "additionalProperties": false,
      "properties": {
        "documentId": {
          "type": "string",
          "pattern": "^[a-zA-Z][a-zA-Z0-9_-]*$",
          "description": "Identifier of the document or signing surface this authored signature affirms.",
          "examples": ["benefitsApplication", "grantCertification"]
        },
        "signatureValue": {
          "type": "string",
          "minLength": 1,
          "description": "Opaque signature evidence value or reference. This may be a data URL from a drawn-signature control, an attachment reference, a detached signature blob, or a provider-managed ceremony reference. A signatureValue alone MUST NOT be treated as sufficient signing intent.",
          "examples": [
            "data:image/png;base64,iVBORw0KGgoAAAANSUhEUgAA...",
            "urn:agency.gov:signature-artifacts:ceremony-2026-0001:primary"
          ]
        },
        "signatureMethod": {
          "type": "string",
          "pattern": "^(drawn|typed|cryptographic|provider-managed|x-[a-z0-9][a-z0-9-]*)$",
          "description": "How the signature evidence was captured.",
          "examples": ["drawn", "provider-managed"]
        },
        "signerId": {
          "type": "string",
          "description": "Stable signer identifier when the host system can provide one. When absent, processors may correlate through the Response author or workflow actor binding.",
          "examples": ["applicant", "user-42"]
        },
        "signerName": {
          "type": "string",
          "minLength": 1,
          "description": "Human-readable signer name captured at authoring time.",
          "examples": ["Ada Lovelace"]
        },
        "signedAt": {
          "type": "string",
          "format": "date-time",
          "description": "RFC 3339 timestamp when the signer completed the authored signing act.",
          "examples": ["2026-04-22T12:00:00Z"]
        },
        "consentAccepted": {
          "type": "boolean",
          "description": "Whether the signer explicitly accepted the declared consent text as part of the signing act.",
          "examples": [true]
        },
        "consentTextRef": {
          "type": "string",
          "format": "uri",
          "description": "URI reference to the consent text the signer accepted. This keeps signing intent bound to declared text rather than to the signature image alone.",
          "examples": ["urn:agency.gov:consent:esign-benefits:v1"]
        },
        "consentVersion": {
          "type": "string",
          "minLength": 1,
          "description": "Version of the consent text accepted by the signer.",
          "examples": ["1.0.0"]
        },
        "affirmationText": {
          "type": "string",
          "minLength": 1,
          "description": "Affirmation text shown to and accepted by the signer at authoring time.",
          "examples": ["I certify under penalty of perjury that this submission is true and complete."]
        },
        "documentHash": {
          "type": "string",
          "pattern": "^[A-Fa-f0-9]{64,128}$",
          "description": "Digest of the document bytes, rendered view, or canonical signing payload that the signer affirmed. This binds the signing act to content stronger than a drawn image alone.",
          "examples": ["0123456789abcdef0123456789abcdef0123456789abcdef0123456789abcdef"]
        },
        "documentHashAlgorithm": {
          "type": "string",
          "pattern": "^(sha-256|sha-384|sha-512|x-[a-z0-9][a-z0-9-]*)$",
          "description": "Digest algorithm used to compute documentHash.",
          "examples": ["sha-256"]
        },
        "responseId": {
          "type": "string",
          "minLength": 1,
          "description": "Identifier of the Response this authored signature binds to. It MUST match the top-level Response id when the envelope is persisted.",
          "examples": ["resp-2026-0001"]
        },
        "identityProofRef": {
          "type": "string",
          "format": "uri",
          "description": "URI reference to the identity-proofing artifact or proof bundle associated with this signing act, when one exists.",
          "examples": ["urn:agency.gov:identity-proof:case-2026-0042"]
        },
        "identityBinding": {
          "$ref": "#/$defs/AuthoredSignatureIdentityBinding"
        },
        "signatureProvider": {
          "type": "string",
          "minLength": 1,
          "description": "Provider or adapter that supplied the signing ceremony evidence.",
          "examples": ["urn:agency.gov:signature:providers:formspec"]
        },
        "ceremonyId": {
          "type": "string",
          "minLength": 1,
          "description": "Identifier for the signing ceremony or provider session that produced this authored signature evidence.",
          "examples": ["ceremony-2026-0001"]
        }
      }
    }
  },
  "properties": {
    "$formspecResponse": {
      "type": "string",
      "const": "1.0",
      "description": "Response specification version. MUST be '1.0'.",
      "examples": ["1.0"],
      "x-lm": {
        "critical": true,
        "intent": "Version pin for response document compatibility."
      }
    },
    "definitionUrl": {
      "type": "string",
      "format": "uri",
      "description": "The canonical URL of the Definition this Response was created against. This is the stable logical-form identifier shared across all versions of the same form. Combined with definitionVersion to form the immutable identity reference. MUST match the 'url' property of a known Definition.",
      "examples": [
        "https://example.org/forms/intake",
        "https://grants.example.gov/forms/sf-425",
        "https://example.gov/forms/annual-report"
      ],
      "x-lm": {
        "critical": true,
        "intent": "Canonical identifier of the form definition used to produce this response. Stable across definition versions."
      }
    },
    "definitionVersion": {
      "type": "string",
      "minLength": 1,
      "description": "The exact version of the Definition against which this Response was created. Interpretation of the version string is governed by the Definition's versionAlgorithm (default: semver). A Response is always validated against this specific version, never against a newer version — even if one exists (Pinning Rule VP-01). Once set, this value MUST NOT change for the lifetime of the Response.",
      "examples": [
        "2.1.0",
        "1.0.0-rc.1",
        "2025.06.01",
        "42"
      ],
      "x-lm": {
        "critical": true,
        "intent": "Exact pinned definition version for validation and replay. Immutable after creation."
      }
    },
    "status": {
      "type": "string",
      "enum": ["in-progress", "completed", "amended", "stopped"],
      "description": "The current lifecycle status of this Response. 'in-progress': actively being edited, MAY contain validation errors. 'completed': all error-severity validation results resolved, form submitted — a Response with one or more error-severity results MUST NOT be marked completed. 'amended': previously completed, reopened for modification. 'stopped': abandoned before completion, data preserved for audit. Saving data MUST never be blocked by validation status (VE-05) — only the transition to 'completed' requires zero error-level results.",
      "examples": ["in-progress", "completed", "amended", "stopped"],
      "x-lm": {
        "critical": true,
        "intent": "Lifecycle state controlling completion semantics and submission eligibility."
      }
    },
    "data": {
      "type": "object",
      "description": "The primary Instance — the form data. Structure mirrors the Definition's item tree: field Items produce scalar properties, non-repeatable group Items produce nested objects, repeatable group Items produce arrays of objects, display Items have no representation. Non-relevant fields are handled per the Definition's nonRelevantBehavior setting: 'remove' (default) omits them entirely, 'empty' retains the key with null value, 'keep' retains the last value. Calculated fields (those with a 'calculate' Bind) are included with their computed values.",
      "additionalProperties": true,
      "examples": [
        {
          "firstName": "Ada",
          "lastName": "Lovelace"
        },
        {
          "has_subcontracts": true,
          "subcontracting": [
            {
              "subcontractor_name": "Acme Analytics, LLC",
              "subcontractor_ein": "84-1234567",
              "subcontract_amount": 45000.00,
              "work_description": "Statistical modeling and data analysis."
            }
          ],
          "subcontract_total": 45000.00
        },
        {
          "has_subcontracts": false
        }
      ],
      "x-lm": {
        "critical": true,
        "intent": "Primary response payload captured from the form instance. Shape determined by the Definition's item tree."
      }
    },
    "authored": {
      "type": "string",
      "format": "date-time",
      "description": "When the Response was last modified (ISO 8601 date-time with timezone). Updated on every save, not just on status transitions. Used for conflict detection, audit trails, and ordering Responses chronologically.",
      "examples": [
        "2025-07-10T14:30:00Z",
        "2025-12-01T09:15:30-05:00"
      ],
      "x-lm": {
        "critical": true,
        "intent": "Last-modified timestamp for conflict detection and audit."
      }
    },
    "id": {
      "type": "string",
      "description": "A globally unique identifier for this Response (e.g., UUID v4). While optional in the schema, implementations SHOULD generate an id for every Response to support cross-system correlation, audit trails, amendment chains, and deduplication. When authoredSignatures are present, id becomes REQUIRED so each authored signature can bind to a stable responseId.",
      "examples": [
        "550e8400-e29b-41d4-a716-446655440000",
        "resp-2025-00042"
      ]
    },
    "author": {
      "type": "object",
      "description": "Identifier and display name of the person or system that authored the Response. For human authors, 'id' is typically a user account identifier; for automated systems, 'id' identifies the service or integration.",
      "required": ["id"],
      "additionalProperties": false,
      "properties": {
        "id": {
          "type": "string",
          "description": "Unique identifier of the author within the host system.",
          "examples": ["user-42", "system:batch-import", "urn:oid:2.16.840.1.113883.4.6"]
        },
        "name": {
          "type": "string",
          "description": "Display name of the author. For human authors, typically their full name.",
          "examples": ["Dr. Grace Hopper", "Batch Import Service"]
        }
      },
      "examples": [
        { "id": "user-42", "name": "Dr. Grace Hopper" },
        { "id": "system:etl-pipeline" }
      ]
    },
    "subject": {
      "type": "object",
      "description": "The entity this Response is about — the grant, patient, project, or other domain object the form data describes. Distinct from 'author' (who filled in the form).",
      "required": ["id"],
      "additionalProperties": false,
      "properties": {
        "id": {
          "type": "string",
          "description": "Unique identifier of the subject entity within the host system.",
          "examples": ["grant-2025-04817", "patient-12345", "org-northwind"]
        },
        "type": {
          "type": "string",
          "description": "The type of the subject entity. Implementations SHOULD use consistent type labels within a system.",
          "examples": ["Grant", "Patient", "Organization", "Project"]
        }
      },
      "examples": [
        { "id": "grant-2025-04817", "type": "Grant" },
        { "id": "patient-12345", "type": "Patient" }
      ]
    },
    "validationResults": {
      "type": "array",
      "description": "The most recent set of ValidationResult entries for this Response. Includes results from all sources: bind constraints, validation shapes, required checks, type checks, and external validation. Only error-severity results block the transition to 'completed' status. Warning and info results are advisory. Non-relevant fields MUST NOT produce results. When persisted alongside the Response, this array represents a snapshot — it may be stale if the data has changed since the last validation run.",
      "items": {
        "$ref": "https://formspec.org/schemas/validationResult/1.0"
      },
      "examples": [
        [],
        [
          {
            "path": "ssn",
            "severity": "error",
            "constraintKind": "constraint",
            "message": "SSN must be in the format 000-00-0000.",
            "code": "CONSTRAINT_FAILED",
            "source": "bind",
            "constraint": "matches($, '^[0-9]{3}-[0-9]{2}-[0-9]{4}$')"
          }
        ],
        [
          {
            "path": "budget_justification",
            "severity": "error",
            "constraintKind": "required",
            "message": "This field is required.",
            "code": "REQUIRED",
            "source": "bind"
          },
          {
            "path": "total_expenditure",
            "severity": "warning",
            "constraintKind": "shape",
            "message": "Proposed expenditure differs from prior year by 40%. Changes exceeding 25% require additional justification.",
            "code": "YOY_VARIANCE",
            "source": "shape",
            "shapeId": "yoy-variance-warning",
            "value": 280000.00
          }
        ]
      ]
    },
    "authoredSignatures": {
      "type": "array",
      "minItems": 1,
      "description": "Canonical authored-signature evidence records attached to this Response. Each entry binds one signer/document act to the Response envelope. These records are distinct from respondent-ledger attestations: they are authored evidence produced at signing time, not later audit-history observations.",
      "items": {
        "$ref": "#/$defs/AuthoredSignature"
      },
      "examples": [
        [
          {
            "documentId": "benefitsApplication",
            "signatureValue": "data:image/png;base64,iVBORw0KGgoAAAANSUhEUgAA...",
            "signatureMethod": "drawn",
            "signerId": "applicant",
            "signerName": "Ada Lovelace",
            "signedAt": "2026-04-22T12:00:00Z",
            "consentAccepted": true,
            "consentTextRef": "urn:agency.gov:consent:esign-benefits:v1",
            "consentVersion": "1.0.0",
            "affirmationText": "I certify under penalty of perjury that this submission is true and complete.",
            "documentHash": "0123456789abcdef0123456789abcdef0123456789abcdef0123456789abcdef",
            "documentHashAlgorithm": "sha-256",
            "responseId": "resp-2026-0001",
            "identityProofRef": "urn:agency.gov:identity-proof:case-2026-0042",
            "identityBinding": {
              "method": "email-otp",
              "assuranceLevel": "standard",
              "providerRef": "urn:agency.gov:identity:providers:email-otp"
            },
            "signatureProvider": "urn:agency.gov:signature:providers:formspec",
            "ceremonyId": "ceremony-2026-0001"
          }
        ]
      ]
    },
    "extensions": {
      "type": "object",
      "description": "Implementor-specific extension data. All keys MUST be prefixed with 'x-'. Processors MUST ignore unrecognized extensions and MUST preserve them during round-tripping. Extensions MUST NOT alter core semantics (validation, calculation, relevance, required state).",
      "propertyNames": { "pattern": "^x-" },
      "examples": [
        {
          "x-audit": { "submittedBy": "user-42", "ipAddress": "10.0.0.1" },
          "x-workflow": { "stage": "review", "assignee": "reviewer-7" }
        }
      ]
    }
  }
}
