{
    "$formspecResponse": "1.0",
    "definitionUrl": "https://formspec.org/examples/clinical-intake",
    "definitionVersion": "1.0.0",
    "status": "in-progress",
    "authored": "2026-03-04T13:05:00Z",
    "data": {
        "patient": {
            "firstName": "Jamie",
            "lastName": "Rivera",
            "dob": "1980-05-14",
            "age": 45,
            "sex": "female",
            "phone": "(202) 555-0199",
            "email": "jamie.rivera@example.test",
            "insuranceMemberId": "ABC1234567",
            "insuranceCard": null
        },
        "currentVisit": {
            "symptoms": [],
            "otherSymptoms": null,
            "onsetDate": null,
            "onsetTime": null,
            "appointmentDateTime": null,
            "provider": null
        },
        "medicalHistory": {
            "hasAllergies": null,
            "allergies": null,
            "conditions": []
        },
        "assessment": {
            "totalConditions": 0,
            "severeConditionCount": 0,
            "totalMedications": 0,
            "symptomDuration": null,
            "maskedInsuranceId": "****4567"
        }
    }
}
