{
    "$formspecResponse": "1.0",
    "id": "a1b2c3d4-e5f6-7890-abcd-ef1234567890",
    "definitionUrl": "https://example.gov/forms/grant-application",
    "definitionVersion": "1.0.0",
    "status": "in-progress",
    "authored": "2026-02-28T09:30:00.000Z",
    "author": {
        "id": "user-002",
        "name": "John Doe"
    },
    "subject": {
        "id": "GRANT-2026-002",
        "type": "grant-application"
    },
    "validationResults": [
        {
            "$formspecValidationResult": "1.0",
            "path": "applicantInfo.orgName",
            "severity": "error",
            "constraintKind": "required",
            "message": "Organization Name is required.",
            "code": "FIELD_REQUIRED",
            "source": "bind",
            "sourceId": "applicantInfo.orgName"
        },
        {
            "$formspecValidationResult": "1.0",
            "path": "projectNarrative.abstract",
            "severity": "warning",
            "constraintKind": "constraint",
            "message": "Abstract appears to contain placeholder text. Replace 'TBD' with actual content.",
            "code": "ABSTRACT_PLACEHOLDER",
            "source": "shape",
            "shapeId": "abstractNotPlaceholder",
            "value": "TBD - will fill in later"
        },
        {
            "$formspecValidationResult": "1.0",
            "path": "projectNarrative.startDate",
            "severity": "error",
            "constraintKind": "required",
            "message": "Project Start Date is required.",
            "code": "FIELD_REQUIRED",
            "source": "bind",
            "sourceId": "projectNarrative.startDate"
        }
    ],
    "data": {
        "applicantType": "nonprofit",
        "isReturning": false,
        "requestedAmount": {
            "amount": "0.00",
            "currency": "USD"
        },
        "applicantInfo": {
            "orgType": "nonprofit",
            "contactName": "John Doe",
            "contactEmail": "john@example.org"
        },
        "projectNarrative": {
            "projectTitle": "Community Education Program",
            "abstract": "TBD - will fill in later"
        },
        "budget": {
            "requestedAmount": {
                "amount": "0.00",
                "currency": "USD"
            },
            "usesSubcontractors": false
        }
    }
}
