{
    "$formspecResponse": "1.0",
    "definitionUrl": "https://formspec.org/examples/clinical-intake",
    "definitionVersion": "1.0.0",
    "status": "in-progress",
    "authored": "2026-03-04T13:01:00Z",
    "data": {
        "patient": {
            "firstName": "Sarah",
            "lastName": "Johnson",
            "dob": "1990-08-22",
            "insuranceId": "INS-5544332"
        },
        "currentVisit": {
            "appointmentDate": "2026-03-04",
            "symptoms": [
                "cough"
            ],
            "onsetDate": "2026-03-01"
        },
        "medicalHistory": {
            "hasAllergies": false,
            "conditions": []
        }
    }
}
